{
  "schema": "shiftory.benchmark-agent-quality-invalidated-capture/v1",
  "status": "invalidated-protocol-not-precommitted-v1",
  "reason_code": "retry-after-unrecoverable-shared-directory-collision",
  "config_id": "config-a",
  "original_case_id": "binary-asset-replacement",
  "corrected_case_id": "binary-asset-replacement",
  "reason": "This capture (recap2-bar-a) was recorded as an official, first-attempt registry_version 2 capture, but it was in fact a SECOND invocation for this case/config: the first invocation's output was silently lost to a shared-prompt-directory collision (see invalidated/binary-asset-replacement/lost-generation-attempts/config-a.json for the honest incident record of that lost first attempt). registry_version 2's own invocation_protocol already declared one_attempt_only/no_retry, so generating and recording a second invocation after the first was silently overwritten -- however unintentional -- violates that declared invariant for this capture, independent of whether its content or protocol-commit verification otherwise holds (both do). Withdrawn and replaced with a genuinely first, one-shot invocation generated after registry_version 3 was committed, which adds unique_prompt_directory_per_invocation, output_directory_must_not_preexist, and exclusive_directory_creation specifically to make this class of defect structurally impossible.",
  "discovered_by": {
    "actor_type": "agent",
    "actor": "GitHub Copilot CLI (parent coordinating session)",
    "method": "Integrity review of the registry_version 2 recapture round identified that the surviving captures for these three cases were second invocations under a protocol that already declared one_attempt_only, because the true first invocations were lost to a directory collision rather than genuinely absent.",
    "timestamp": "2026-09-02T10:56:00Z"
  },
  "original_prompt_package_digest": "24e885ea889c12cf78c1d5c761e78fe33378eef46e08931f201ad503c35ccad2",
  "archived_raw_response_sha256": "a8226e6d6b4a2edab0350208cb16a9d4d1e8d2381ff76697ebc848c6904433b1",
  "archived_raw_response_bytes": 1530,
  "archived_explanation_sha256": null,
  "archived_agent_run_sha256": "a3b4035a22d32764d1f4cc263509e641252fe70bf70c396f13fb32acceb2e9d4",
  "archived_evaluation_sha256": "252e127e6241eea6ab23f95dd9900d99fd9adc9a9c1cff572578533787d02a63",
  "archived_score_sha256": "52b6f62cc90ef71dc7fc85e4195edf58a1331e33044025aad6618e11469b6bc3",
  "replacement_capture": {
    "case_id": "binary-asset-replacement",
    "config_id": "config-a",
    "path": "benchmarks/agent_quality/cases/binary-asset-replacement/captured/config-a"
  }
}
