{
  "schema": "shiftory.benchmark-agent-quality-invalidated-capture/v1",
  "status": "invalidated-answer-leak-v1",
  "config_id": "config-a",
  "original_case_id": "delete-add-not-a-rename",
  "corrected_case_id": "cross-file-validation-edit",
  "reason": "The original case.json/metadata.json description ('a similarly named, but behaviorally weaker, function is added') and category ('deletion-addition-confused-with-move') were materialized verbatim into this capture's prompt package (agent_harness.prepare_prompt_package copies case.json unmodified). Together they disclosed both importance-5 rubric conclusions -- that the replacement is weaker, and that this is not a behavior-preserving move/rename -- before the generating agent analyzed the diff. This capture's own explanation used the word 'weaker' verbatim, matching the leaked description, so it cannot be treated as independent evidence. Withdrawn rather than edited in place; the case was renamed and its description/category rewritten to state only mechanical, directly-visible facts (function name, affected files, deletion vs. addition), and both captures for this case were redone from scratch under the corrected package.",
  "leaked_prompt_package_fields": {
    "category": "deletion-addition-confused-with-move",
    "description": "A validate_email function is deleted from one file and a similarly named, but behaviorally weaker, function is added to a different file."
  },
  "leaked_required_fact_ids": [
    "weaker-validate-email-added-to-utils",
    "not-a-behavior-preserving-move"
  ],
  "discovered_by": {
    "actor_type": "agent",
    "actor": "GitHub Copilot CLI (parent coordinating session, cross-session review)",
    "method": "Independent complete-diff review of the pushed PR #4 head, auditing every materialized prompt package's case.json against its rubric's required_facts for verbatim or paraphrased conclusion leakage.",
    "timestamp": "2026-09-02T03:00:00Z"
  },
  "original_prompt_package_digest": "3e46a931b7564e481523f60ad5f20adb8ea07857ea9b6eeaef69daa7220493b7",
  "archived_raw_response_sha256": "59819324e25d4cc020c7eff8215edaa8512081fde512a32091c889d1cff17113",
  "archived_raw_response_bytes": 2140,
  "archived_explanation_sha256": "59819324e25d4cc020c7eff8215edaa8512081fde512a32091c889d1cff17113",
  "archived_agent_run_sha256": "293bcad4f54de0110d1c936e8a0f55366e9270a75d5f78319982a32adb79a657",
  "archived_evaluation_sha256": "eb4c0a1c08d7df4842fc7347a8fb0bbafa2c937031870bc824e0d7507ed2dfa7",
  "archived_score_sha256": "a09e1026165447df6eb1d90280edb062b5fbc47df24be0c95d4a6fc8f8a5ceda",
  "replacement_capture": {
    "case_id": "cross-file-validation-edit",
    "config_id": "config-a",
    "path": "benchmarks/agent_quality/cases/cross-file-validation-edit/captured/config-a"
  }
}
